{
  "schemaVersion": "0.1.0",
  "episodeId": "87d90eb9-35a7-57c2-8316-f907eed2734d",
  "kind": "certified_refutation",
  "capturedAt": "2026-07-21T11:08:26Z",
  "acceptanceInfluence": false,
  "qualityTier": "Q1_checker_preview",
  "provenance": {
    "sourceKind": "committed_evidence",
    "sourcePath": "evidence/conjecture/finite_graph/foundry_episodes",
    "sourceFamily": "finite_graph_conjecture",
    "license": "Apache-2.0",
    "publicationAllowed": true,
    "userConsent": "not_applicable",
    "backendId": "agent.enumerate",
    "adapterVersion": "0.1.0",
    "checkerPackage": "logic.finite_counterexample",
    "notes": "FiniteGraph calibrated/expanded falsification; finite_graph.v0.2.0"
  },
  "contamination": {
    "inPublicLibrary": false,
    "publicLibraryRefs": [],
    "trainEvalSeparation": "unassigned",
    "duplicateOf": null,
    "contentDigest": "sha256:676987d03a222ba7068aba4c941deac90e80e888168af979151ce96fa8b96343",
    "benchmarkExclusion": false,
    "notes": "Source-family split applied at corpus build."
  },
  "toolUse": {
    "capabilityCandidates": [
      "logic.finite_counterexample",
      "algebra.rational_equality",
      "algebra.linear_algebra"
    ],
    "selectedCapability": "logic.finite_counterexample",
    "selectedOperation": "refutation",
    "requestedClaim": "refutation",
    "backendId": "agent.enumerate",
    "selectionRationale": "FiniteGraph candidate fin5_subset_0001000111"
  },
  "outcome": {
    "resultStatus": "witness_verified",
    "claimClass": "refutation",
    "assuranceMode": "lean_checker_mirror",
    "requestDigest": "sha256:7705b6f24224377a693fc1ab21c469d3f3d830087537d115b463f7775e98ac18",
    "replayable": true,
    "negative": false,
    "negativeKind": "none",
    "errorCodes": [],
    "humanReviewLabels": []
  },
  "artifactRefs": [
    "evidence/conjecture/finite_graph/foundry_episodes",
    "evidence/conjecture/finite_graph/counterexamples.json"
  ],
  "payload": {
    "candidateId": "fin5_subset_0001000111",
    "generatorVersion": "finite_graph.v0.2.0",
    "request": {
      "schemaVersion": "0.1.0",
      "capability": "logic.finite_counterexample",
      "capabilityVersion": "0.1.0",
      "predicate": {
        "varNames": [
          "e01",
          "e02",
          "e03",
          "e04",
          "e12",
          "e13",
          "e14",
          "e23",
          "e24",
          "e34"
        ],
        "domains": [
          {
            "ty": "bool"
          },
          {
            "ty": "bool"
          },
          {
            "ty": "bool"
          },
          {
            "ty": "bool"
          },
          {
            "ty": "bool"
          },
          {
            "ty": "bool"
          },
          {
            "ty": "bool"
          },
          {
            "ty": "bool"
          },
          {
            "ty": "bool"
          },
          {
            "ty": "bool"
          }
        ],
        "pred": {
          "tag": "and",
          "left": {
            "tag": "and",
            "left": {
              "tag": "and",
              "left": {
                "tag": "eq",
                "left": {
                  "tag": "var",
                  "idx": 0
                },
                "right": {
                  "tag": "lit",
                  "v": {
                    "tag": "bool",
                    "v": true
                  }
                }
              },
              "right": {
                "tag": "eq",
                "left": {
                  "tag": "var",
                  "idx": 1
                },
                "right": {
                  "tag": "lit",
                  "v": {
                    "tag": "bool",
                    "v": true
                  }
                }
              }
            },
            "right": {
              "tag": "eq",
              "left": {
                "tag": "var",
                "idx": 2
              },
              "right": {
                "tag": "lit",
                "v": {
                  "tag": "bool",
                  "v": true
                }
              }
            }
          },
          "right": {
            "tag": "eq",
            "left": {
              "tag": "var",
              "idx": 6
            },
            "right": {
              "tag": "lit",
              "v": {
                "tag": "bool",
                "v": true
              }
            }
          }
        }
      },
      "requestedClaim": "refutation",
      "resourcePolicy": {
        "maxWallTimeMs": 60000,
        "maxOutputBytes": 1048576
      },
      "requestDigest": "sha256:7705b6f24224377a693fc1ab21c469d3f3d830087537d115b463f7775e98ac18"
    },
    "certificate": {
      "schemaVersion": "0.1.0",
      "capability": "logic.finite_counterexample",
      "capabilityVersion": "0.1.0",
      "requestDigest": "sha256:7705b6f24224377a693fc1ab21c469d3f3d830087537d115b463f7775e98ac18",
      "witness": {
        "assignment": [
          {
            "tag": "bool",
            "v": false
          },
          {
            "tag": "bool",
            "v": false
          },
          {
            "tag": "bool",
            "v": false
          },
          {
            "tag": "bool",
            "v": false
          },
          {
            "tag": "bool",
            "v": false
          },
          {
            "tag": "bool",
            "v": false
          },
          {
            "tag": "bool",
            "v": false
          },
          {
            "tag": "bool",
            "v": false
          },
          {
            "tag": "bool",
            "v": false
          },
          {
            "tag": "bool",
            "v": false
          }
        ]
      },
      "provenance": {
        "backendId": "agent.enumerate",
        "adapterVersion": "0.1.0",
        "deterministic": true
      }
    },
    "mirrorAccepted": true
  },
  "notes": "Replayable certified refutation; acceptanceInfluence=false. ME-RV-080: downgraded from Q2_formally_verified \u2014 lacks Certification Record / theorem identity / environment lock (checker-preview only)."
}
