{
  "schemaVersion": "0.1.0",
  "episodeId": "43d1b2b3-51e3-5721-b0ad-6dac49331ed8",
  "kind": "evidence_bundle",
  "capturedAt": "2026-07-21T11:08:39Z",
  "acceptanceInfluence": false,
  "qualityTier": "Q1_checker_preview",
  "provenance": {
    "sourceKind": "committed_evidence",
    "sourcePath": "evidence/examples/ideal_membership_mathematica_offline_xy",
    "sourceFamily": "evidence_examples",
    "sourceDate": "2026-07-21T00:00:00Z",
    "license": "Apache-2.0",
    "publicationAllowed": true,
    "userConsent": "not_applicable",
    "backendId": "mathematica",
    "backendVersion": "fixture",
    "adapterVersion": "0.1.0",
    "checkerPackage": "algebra.ideal_membership_witness",
    "notes": "Ingested from committed evidence; never consulted by Lean acceptance."
  },
  "contamination": {
    "inPublicLibrary": false,
    "publicLibraryRefs": [],
    "trainEvalSeparation": "train",
    "duplicateOf": null,
    "contentDigest": "sha256:b72124fb2fd5472c6a7c0b455acd40d0d5d96ce2c90c7ee6985a7bfccdd5fd50",
    "benchmarkExclusion": false,
    "notes": "Split assignment applied by foundry.pipelines.split."
  },
  "toolUse": {
    "capabilityCandidates": [
      "algebra.rational_equality",
      "algebra.linear_algebra",
      "algebra.ideal_membership_witness",
      "logic.finite_counterexample",
      "logic.sat_unsat",
      "logic.pseudo_boolean",
      "logic.smt",
      "algebra.formal_rational_calculus"
    ],
    "selectedCapability": "algebra.ideal_membership_witness",
    "requestedClaim": "candidate",
    "backendId": "mathematica",
    "selectionRationale": "Committed example for capability algebra.ideal_membership_witness."
  },
  "outcome": {
    "resultStatus": "computed",
    "claimClass": "candidate",
    "assuranceMode": "native_checked",
    "requestDigest": "sha256:b655e351184769e51b6b9458b8cb8b0bcf4541524c12d640aaa91a06e780001c",
    "replayable": true,
    "negative": false,
    "negativeKind": "none",
    "errorCodes": [],
    "humanReviewLabels": []
  },
  "artifactRefs": [
    "evidence/examples/ideal_membership_mathematica_offline_xy"
  ],
  "payload": {
    "manifestKeys": [
      "assuranceMode",
      "bundleVersion",
      "capability",
      "claimClass",
      "files",
      "provenance",
      "requestDigest",
      "resultStatus"
    ],
    "hasCertificate": true,
    "hasCandidate": true
  },
  "notes": "Corpus episode built from evidence; acceptanceInfluence=false. ME-RV-080: downgraded from Q2_formally_verified \u2014 lacks Certification Record / theorem identity / environment lock (checker-preview only)."
}
